ID,制度のタイトル,お問い合わせ先,対象地域,概要,詳細情報URL
148,"施設・設備の復旧・整備に対する補助・融資","県の中小企業担当課等","岩手県//宮城県//福島県","被災された中小企業等のグループ、事業協同組合などの施設の復旧・整備、修繕に対し、補助による支援を実施します。",http://www.r-assistance.go.jp/contentdetail_k.aspx?ContentID=148
86,"被災者生活再建支援制度","都道府県、市町村","岩手県//宮城県//福島県","●災害により住宅が全壊するなど、生活基盤に著しい被害を受けた世帯に対して支援金を支給します。",http://www.r-assistance.go.jp/contentdetail_k.aspx?ContentID=86
390,"がんばろう福島県の企業！産業復旧・復興事業","商工労働部","福島県","東日本大震災及び原子力発電所事故による被災者や求職者の雇用の場を確保するとともに、成長産業分野や新規創業、企業再開を目指す企業等における人材確保・育成を支援するための事業を実施しています。",http://www.r-assistance.go.jp/contentdetail_k.aspx?ContentID=390
210,"復興支援・住宅エコポイント","住宅エコポイント事務局","","エコ住宅の新築またはエコリフォームを行った場合に、被災地の商品やエコ商品などに交換可能なポイントが発行されます。",http://www.r-assistance.go.jp/contentdetail_k.aspx?ContentID=210
174,"地方税の特別措置","都道府県、市町村(税務課など)","岩手県//宮城県//福島県","●地方税の減免
災害により被害を受けた場合、被災納税者の地方税 (個人住民税、固定資産税、自動車税など)について、一部軽減又は免除を受けることができます。
●徴収の猶予
災害により被害を受けた場合、被災納税者の地方税について、その徴収の猶予を受けることができます。
●期限の延長
災害により申告・納付等を期限までにできない方は、その期限が延長されます。これには、都道府県・市町村が条例で一律に期限を延長している場合と都道府県・市町村への申請により延長が認められる場合があります。一律に期限を延長している場合には手続きは必要ありません。詳しくは、お住まいの都道府県・市町村にお問い合わせください。",http://www.r-assistance.go.jp/contentdetail_k.aspx?ContentID=174
78,"災害援護資金","市町村","岩手県//宮城県//福島県","●災害により負傷又は住宅、家財の損害を受けた方に対して、災害弔慰金の支給等に関する法律に基づき、生活の再建に必要な資金を貸し付けます。",http://www.r-assistance.go.jp/contentdetail_k.aspx?ContentID=78
209,"フラット３５Ｓの金利引下げ幅の拡大","フラット３５Ｓ取扱いの金融機関または独立行政法人住宅金融支援機構ＴＥＬ：０１２０−０８６−３５３","","省エネルギー性が優れた住宅を取得する場合のフラット３５Ｓの金利引下げ幅を拡大します",http://www.r-assistance.go.jp/contentdetail_k.aspx?ContentID=209
134,"放送受信料の免除","日本放送協会","青森県//岩手県//宮城県//福島県//茨城県//栃木県//千葉県//新潟県//長野県","●災害により被害を受けた受信契約者に対して、一定期間ＮＨＫの放送受信料が免除されます。",http://www.r-assistance.go.jp/contentdetail_k.aspx?ContentID=134
79,"災害復興住宅融資（建設）","お取り扱いの金融機関または独立行政法人住宅金融支援機構ＴＥＬ：０１２０−０８６−３５３","","●自然現象により生じた災害又は自然現象以外の原因による災害のうち独立行政法人住宅金融支援機構が個別に指定する災害により被害を受けた住宅の所有者が、住宅を建設する場合に受けられる融資です。",http://www.r-assistance.go.jp/contentdetail_k.aspx?ContentID=79
82,"住宅金融支援機構融資の返済方法の変更","お取り扱いの金融機関または独立行政法人住宅金融支援機構ＴＥＬ：０１２０−０８６−３５３","","●独立行政法人住宅金融支援機構が指定する災害により被害を受けたご返済中の被災者（旧住宅金融公庫から融資を受けてご返済中の被災者を含む。）に対して、返済方法を変更することにより被災者を支援するものです。",http://www.r-assistance.go.jp/contentdetail_k.aspx?ContentID=82
123,"施設の復旧など","都道府県衛生主管部局の各施設担当窓口","岩手県//宮城県//福島県","医療サービス等の復旧・支援を進めています。",http://www.r-assistance.go.jp/contentdetail_k.aspx?ContentID=123
351,"中小企業等復旧・復興支援制度","最寄りの各地方振興局（地域づくり・商工労政課）","福島県","東日本大震災・福島第一原子力発電所事故により被害を受けた中小企業等の皆様に、事業再開に必要となる経費の一部を補助する制度を創設しました。",http://www.r-assistance.go.jp/contentdetail_k.aspx?ContentID=351
96,"り災証明書","市町村","岩手県//宮城県//福島県","り災証明書は、地方自治法第２条に定める自治事務として、市町村が被災状況の現地調査等を行い、確認した事実に基づき発行する証明書であり、各種の被災者支援制度の適用を受けるにあたって必要とされる家屋の被害程度について証明するものです。",http://www.r-assistance.go.jp/contentdetail_k.aspx?ContentID=96
220,"被災者の健康支援","被災県の基金事業実施先","岩手県//宮城県//福島県","被災者の方々の心とからだの健康支援を行います",http://www.r-assistance.go.jp/contentdetail_k.aspx?ContentID=220
33,"義援金","各市町村福祉担当課等","宮城県","義援金については，市町村を通じて，被災した方へ支給しております。",http://www.r-assistance.go.jp/contentdetail_k.aspx?ContentID=33
142,"東日本大震災復興特別貸付","日本政策金融公庫、商工組合中央金庫","岩手県//宮城県//福島県","震災により直接又は間接被害を受けた中小企業者の皆さんなどを対象に、事業の復旧に必要な設備資金、運転資金を長期・低利で融資する新たな制度です。",http://www.r-assistance.go.jp/contentdetail_k.aspx?ContentID=142
235,"被災した中小企業の事業継続・再開を支援します　中小企業の新商品開発・販路開拓などを支援します
＜農商工連携等の活用による被災地等復興促進支援事業＞","中小企業庁","岩手県//宮城県//福島県","●東日本大震災により被災した中小企業の振興に向け、以下の取り組みによる新商品開発や販路開拓を全額補助により支援します。",http://www.r-assistance.go.jp/contentdetail_k.aspx?ContentID=235
229,"震災復興技術イノベーション創出実証研究事業","経済産業局","岩手県//宮城県//福島県","被災地域の復興に役立つ産学連携による実証研究を補助します。",http://www.r-assistance.go.jp/contentdetail_k.aspx?ContentID=229
175,"国税の特別措置","税務署","岩手県//宮城県//福島県","●申告などの期限の延長 
災害などの理由により申告、納付などをその期限までにできないときは、その理由のやんだ日から２か月以内の範囲でその期限が延長されます。これには、個別指定による場合と地域指定による場合とがあります。 
●所得税の軽減
災害により住宅や家財などに損害を受けた場合、確定申告で、１．所得税法に定める雑損控除の方法、２．災害減免法に定める税金の軽減免除による方法のどちらか有利な方法を選ぶことによって、所得税の全部又は一部を軽減することができます。 
●予定納税の減額 
災害が発生した後に納期限の到来する予定納税について、税務署長に申請をすることにより、減額を受けることができます。 
●給与所得者の源泉所得税の徴収猶予など 
災害により住宅や家財などに損害を受けた場合、給与所得者が税務署長に申請（一定のものについてはその支払者を経由して税務署長に申請）をすることにより所得金額の見積額に応じて源泉所得税額の徴収猶予や還付を受けることができます。 
●納税の猶予 
災害により被害を受けた場合、税務署長に申請をすることにより、納税の猶予を受けることができます。",http://www.r-assistance.go.jp/contentdetail_k.aspx?ContentID=175
80,"災害復興住宅融資（新築購入、リ・ユース購入）","お取り扱いの金融機関または独立行政法人住宅金融支援機構ＴＥＬ：０１２０−０８６−３５３","","●自然現象により生じた災害又は自然現象以外の原因による災害のうち独立行政法人住宅金融支援機構が個別に指定する災害により被害を受けた住宅の所有者が、新築住宅、リ・ユース住宅を購入する場合に受けられる融資です。",http://www.r-assistance.go.jp/contentdetail_k.aspx?ContentID=80
384,"地域づくり総合支援事業（サポート事業）","地方振興局地域づくり・商工労政課等","福島県","民間団体や市町村等が行う広域的・先駆的・モデル的な事業でかつ国、県等の既定施策の中で措置することが困難な事業に対して補助金を交付します。",http://www.r-assistance.go.jp/contentdetail_k.aspx?ContentID=384
133,"公共料金・使用料等の特別措置","都道府県、市町村、関係事業者","岩手県//宮城県//福島県","●災害により被害を受けた被災者に対しては、都道府県や市町村において、各自治体が所管する公共料金や施設使用料、保育料等が軽減・免除されることがあります。",http://www.r-assistance.go.jp/contentdetail_k.aspx?ContentID=133
21,"生活再建住宅支援事業補助","県庁建築住宅課　","岩手県","大震災津波で被災した住宅に対し、その利息額を補助します。",http://www.r-assistance.go.jp/contentdetail_k.aspx?ContentID=21
385,"地域づくり総合支援事業（地域協働モデル支援事業）","文化スポーツ局文化振興課","福島県","地域課題（震災対応等を含む。）の解決のため、行政と地域活動団体（自治会、町内会、NPO等）が協働して実施する先駆的なモデル事業に対して補助金を交付します。",http://www.r-assistance.go.jp/contentdetail_k.aspx?ContentID=385
81,"災害復興住宅融資（補修）","お取り扱いの金融機関または独立行政法人住宅金融支援機構ＴＥＬ：０１２０−０８６−３５３","","●自然現象により生じた災害又は自然現象以外の原因による災害のうち独立行政法人住宅金融支援機構が個別に指定する災害により被害を受けた住宅の所有者が、住宅を補修する場合に受けられる融資です。",http://www.r-assistance.go.jp/contentdetail_k.aspx?ContentID=81
233,"被災中小企業復興支援リース補助事業","経済産業省商務流通グループ商取引・消費経済政策課消費経済企画室","岩手県//宮城県//福島県","被災した中小企業が、設備を再度リースにより導入する際の費用を補助します",http://www.r-assistance.go.jp/contentdetail_k.aspx?ContentID=233
85,"住宅の応急修理","都道府県、市町村","岩手県//宮城県//福島県","●災害救助法に基づく住宅の応急修理は災害により住宅が半壊し、自ら修理する資力のない世帯に対して、被災した住宅の居室、台所、トイレ等日常生活に必要な最小限度の部分を応急的に修理します。",http://www.r-assistance.go.jp/contentdetail_k.aspx?ContentID=85
251,"震災復興林業人材育成対策事業","林野庁経営課林業労働対策室","岩手県//宮城県//福島県","林業分野での就業を支援します。",http://www.r-assistance.go.jp/contentdetail_k.aspx?ContentID=251
94,"災害復興宅地融資","お取り扱いの金融機関または独立行政法人住宅金融支援機構ＴＥＬ：０１２０−０８６−３５３","","●東日本大震災により、住宅に被害がなく、宅地にのみ被害を受けた宅地の所有者が、その宅地を補修する場合に受けられる融資です。（災害復興住宅融資との併用はできません。）",http://www.r-assistance.go.jp/contentdetail_k.aspx?ContentID=94
401,"入退去管理支援","土木部建築住宅課","福島県","避難者のための住宅対策として行っている借上げ住宅について、入居されている被災者の入居期間延長のための更新契約、解約、一部新規入居等の円滑な事務手続きを行うものです。",http://www.r-assistance.go.jp/contentdetail_k.aspx?ContentID=401
89,"宅地防災工事資金融資","お取り扱いの金融機関または独立行政法人住宅金融支援機構ＴＥＬ：０１２０−０８６−３５３","","改善勧告又は改善命令を受けた方に対して、のり面の保護、排水施設の設置、整地、擁壁の設置（旧擁壁の除去を含みます。）の工事のための費用を融資します。",http://www.r-assistance.go.jp/contentdetail_k.aspx?ContentID=89
120,"医療保険、介護保険の保険料・窓口負担（利用者負担）の減免・猶予等","各医療保険者、市町村、医療機関、日本年金機構年金事務所","岩手県//宮城県//福島県","●医療保険、介護保険の保険料・窓口負担（利用者負担）について、特例措置が講じられます。",http://www.r-assistance.go.jp/contentdetail_k.aspx?ContentID=120
236,"中小企業の地域産品販路開拓等支援事業","中小企業庁","岩手県//宮城県//福島県","中小企業の販路開拓等を支援します。",http://www.r-assistance.go.jp/contentdetail_k.aspx?ContentID=236
97,"災害弔慰金","市町村","岩手県//宮城県//福島県","●災害により死亡された方のご遺族に対して、災害弔慰金の支給等に関する法律に基づき、災害弔慰金を支給します。",http://www.r-assistance.go.jp/contentdetail_k.aspx?ContentID=97
274,"法人および個人事業主の方に関する主な損害項目における賠償基準の概要
【いわゆる間接被害について】
〈営業損害〉","福島原子力補償相談室（コールセンター）","岩手県//宮城県//福島県","賠償基準：間接被害による減収分（逸失利益） ＋ 追加的費用",http://www.r-assistance.go.jp/contentdetail_k.aspx?ContentID=274
349,"ふくしま復興特別資金","県庁経営金融課","福島県","東日本大震災の影響を受けた中小企業の皆さまを支援するため、新たな融資制度を創設しています。",http://www.r-assistance.go.jp/contentdetail_k.aspx?ContentID=349
179,"被災者雇用開発助成金の支給","公共職業安定所又は都道府県労働局","岩手県//宮城県//福島県","●東日本大震災による被災離職者及び被災地域に居住する求職者の方を、ハローワーク等の紹介により、継続して１年以上雇用することが見込まれる労働者として雇い入れる事業主に対して、助成金を支給します。（雇用保険の一般被保険者として雇い入れる場合に限ります）",http://www.r-assistance.go.jp/contentdetail_k.aspx?ContentID=179
130,"子どもをはじめ、みなさまの健康の確保のために　福島県民のみなさまの健康確保のための基金を創設しました","福島県保健福祉部健康増進課","福島県","国からの交付金をもとに福島県が基金を創設し、福島県が県民の健康確保のためにさまざまな取り組みを行います。",http://www.r-assistance.go.jp/contentdetail_k.aspx?ContentID=130
202,"生活復興支援資金貸付","各都道府県・市町村の社会福祉協議会","岩手県//宮城県//福島県","被災された方の生活の復興を支援します",http://www.r-assistance.go.jp/contentdetail_k.aspx?ContentID=202
234,"被災した中小企業の事業継続・再開を支援します　新卒者などの中小企業での職場実習を通じて中小企業の人材確保を支援します","中小企業庁経営支援部経営支援課","岩手県//宮城県//福島県","新卒者や卒業後３年以内の未就職者の方々に、被災地域などの中小企業の事業現場などで原則６か月間の職場実習（いわゆるインターンシップ）を行っていただくことで、社会人としての基礎知識や中小企業で必要とされる技術・知識・ノウハウの習得を支援します。",http://www.r-assistance.go.jp/contentdetail_k.aspx?ContentID=234
245,"農山漁村被災者受入円滑化支援事業","農林水産省農村振興局中山間地域振興課","岩手県//宮城県//福島県","他の地域への移転を希望される場合、受入れ地域とのマッチングを支援します。",http://www.r-assistance.go.jp/contentdetail_k.aspx?ContentID=245
95,"登記事項証明書等の交付手数料の特別措置","法務局","岩手県//宮城県//福島県","●登記事項証明書等の交付手数料を免除します。",http://www.r-assistance.go.jp/contentdetail_k.aspx?ContentID=95
201,"自宅が被災した方への融資や修理などの支援策があります　既存の住宅ローンについて","金融機関の電話相談窓口、個人版私的整理ガイドライン運営委員会","岩手県//宮城県//福島県","●金融庁は、金融機関に対して、被災者からの貸付条件の変更などの申し込みに対し、積極的に対応するように要請しています。既存の住宅ローンのご相談については、まずはお取引金融機関にお問い合わせください。金融機関の相談窓口一覧は、金融庁ホームページおよび携帯サイトに掲載しております。",http://www.r-assistance.go.jp/contentdetail_k.aspx?ContentID=201
147,"中小機構による仮設店舗、仮設工場の整備","中小企業基盤整備機構の最寄りの窓口（中小企業復興支援センター、関東支部、震災緊急復興事業推進部）","岩手県//宮城県//福島県","●中小企業基盤整備機構が、東日本大震災の被災地域において、事業活動を再開する複数の中小企業者に入居いただける仮設施設（店舗・工場・事務所）を整備し、市町村に一括して貸与します。市町村が入居者及び入居条件を決定して、原則無料で中小企業者に貸し出します。",http://www.r-assistance.go.jp/contentdetail_k.aspx?ContentID=147
309,"特定地域中小企業特別資金（県内へ移転し事業再開・継続する方）","公益財団法人福島県産業振興センター","福島県","原発事故により県内移転を余儀なくされた中小企業等を対象とした事業継続・再開向け融資制度です。",http://www.r-assistance.go.jp/contentdetail_k.aspx?ContentID=309
400,"共同設備（浄化槽等）の維持管理支援","土木部建築住宅課","福島県","仮設住宅の共同設備である、浄化槽、受水槽の法定点検、清掃、各種検査費用、集会所の消防設備法定点検費用を県で負担するものです。",http://www.r-assistance.go.jp/contentdetail_k.aspx?ContentID=400
339,"民間住宅の借上げ（県内）","避難前に居住していた市町村　など","福島県","平成２３年３月１１日以降、避難された方がみずから手続きして入居した県内の民間賃貸住宅で、市町村が一定の要件に合致することを審査し決定したものについては、県との賃貸借契約に切り替え、借上げ住宅として取り扱います。",http://www.r-assistance.go.jp/contentdetail_k.aspx?ContentID=339
150,"天災融資制度","市町村","岩手県//宮城県//福島県","●天災による被害農林漁業者等に対する資金の融通に関する暫定措置法に基づき、政令で指定された天災によって被害を受けた農林漁業者に対して再生産に必要な低利の経営資金を、被害を受けた農協等の組合に対しては事業資金をそれぞれ融資し、経営の安定化を図ります。",http://www.r-assistance.go.jp/contentdetail_k.aspx?ContentID=150
312,"県民健康管理調査","福島県立医科大学 県民健康管理調査事務局","福島県","　福島県では、原子力災害による放射線の影響を踏まえ、将来にわたる県民の皆さまの健康管理を目的とした「県民健康管理調査」を実施しています。",http://www.r-assistance.go.jp/contentdetail_k.aspx?ContentID=312
90,"地すべり等関連住宅融資","お取り扱いの金融機関または独立行政法人住宅金融支援機構ＴＥＬ：０１２０−０８６−３５３","","●地すべりや急傾斜地の崩壊により被害を受けるおそれのある家屋を移転したり、これに代わるべき住宅を建設する場合の資金を融資します。",http://www.r-assistance.go.jp/contentdetail_k.aspx?ContentID=90
350,"震災対策特別資金","県庁経営金融課","福島県","東日本大震災の影響を受けた中小企業の皆さまを支援するため、新たな融資制度を創設しています。",http://www.r-assistance.go.jp/contentdetail_k.aspx?ContentID=350
318,"被災中小企業施設・設備整備支援事業貸付金について","福島県経営金融課 (金融担当)","福島県","東日本大震災により被害を受けた中小企業者等が施設・設備の整備を行う場合に、(公財)福島県産業振興センターを通じて長期・無利子の融資を行います。",http://www.r-assistance.go.jp/contentdetail_k.aspx?ContentID=318
146,"雇用調整助成金の特例措置","公共職業安定所又は都道府県労働局","青森県//岩手県//宮城県//福島県//茨城県//栃木県//千葉県//新潟県//長野県","●東日本大震災に伴う経済上の理由により事業活動の縮小を余儀なくされた事業主が、雇用を維持するために休業等を実施した場合、休業に係る手当等の事業主負担相当額の一部を助成する制度です。",http://www.r-assistance.go.jp/contentdetail_k.aspx?ContentID=146
373,"女性のための相談事業（生活全般、法律関係、健康関係に係る相談）","福島県男女共生センター","福島県","生活全般、法律関係、健康関係に係る相談を受け付けています。",http://www.r-assistance.go.jp/contentdetail_k.aspx?ContentID=373
281,"主な損害項目における補償基準の概要 
【政府による避難等の指示等に係る損害について】
〈避難生活等による精神的損害〉","福島原子力補償相談室（コールセンター）","福島県","賠償基準：避難された方については，平成２３年３月１１日から平成２３年８月３１日までの避難分として１０万円／月あるいは１２万円／月，平成２３年９月１日から平成２３年１１月３０日までの避難分として１０万円／月あるいは１２万円／月",http://www.r-assistance.go.jp/contentdetail_k.aspx?ContentID=281
326,"災害義援金","県庁社会福祉課","福島県","東日本大震災で被災された皆さまへ、市町村から災害義援金が配付されます。",http://www.r-assistance.go.jp/contentdetail_k.aspx?ContentID=326
320,"「ふるさと絆情報ステーション」開設","福島県文化振興課","福島県","県では、民間借上げ住宅等に入居されている皆さまに、最新の市町村情報などを提供するとともに、情報交換や交流の場として御活用いただける「ふるさと絆情報ステーション」を県内の大型スーパーなど１１ヶ所に開設しています。",http://www.r-assistance.go.jp/contentdetail_k.aspx?ContentID=320
513,"り災住宅補修利子補給金","須賀川市建築住宅課　","福島県須賀川市","須賀川市では、 東日本大震災及びその余震により被災した一部損壊住宅（空家、貸家及び給与住宅等を除く。）の補修に係る借入金の利子を補給する助成制度を実施します。",http://www.r-assistance.go.jp/contentdetail_k.aspx?ContentID=513
512,"り災住宅補修経費助成金","須賀川市建築住宅課　","福島県須賀川市","須賀川市では、 東日本大震災及びその余震により被災した一部損壊住宅（空家、貸家及び給与住宅等を除く。）の補修経費を補給する助成制度を実施します。",http://www.r-assistance.go.jp/contentdetail_k.aspx?ContentID=512
